{"id":"world-record:sha256:487ad248a7425180daa7895597ef0b9ed5825db6fcf9b759e4715899b9261d91","kind":"world-record","payload":{"candidate":"candidate:sha256:83e6d307cccf319c343890b7d74fd12afdd1b77c258db60f848a092547fef99f","evaluation_bundle":null,"genome":"genome:sha256:766453ac865db24d6ffe7c6e63a9c9c28021a0573b07db524e61f3a1763732b9","metrics":{"horizon":25.0,"mean_mass":24.483527276096087},"name":"small-mass-search/g1/1","parents":["candidate:sha256:83219cf3c67417dfa659855cf9964260cb7b3b9e30842108f4afbf07f6e31214"],"preparation":null,"recipe":"recipe:sha256:097d36694e45fbf367e3c3547fba5228ac4185c0486e5e095bb159b038df19b3","run":"generation-run:sha256:33139f16a96cd21510fd5af3b68a0e9af915480e16abe105c8dc6608c3268e1d","score":24.483527276096087},"refs":["candidate:sha256:83219cf3c67417dfa659855cf9964260cb7b3b9e30842108f4afbf07f6e31214","candidate:sha256:83e6d307cccf319c343890b7d74fd12afdd1b77c258db60f848a092547fef99f","generation-run:sha256:33139f16a96cd21510fd5af3b68a0e9af915480e16abe105c8dc6608c3268e1d","genome:sha256:766453ac865db24d6ffe7c6e63a9c9c28021a0573b07db524e61f3a1763732b9","recipe:sha256:097d36694e45fbf367e3c3547fba5228ac4185c0486e5e095bb159b038df19b3"],"schema_version":"blobkit-registry-v1"}
